{
  "$schema": "https://json-schema.org/draft/2020-12/schema",
  "$id": "https://skillbridge.local/contracts/ai-events/v2/ai-event.schema.json",
  "title": "AI event, schema version 2",
  "description": "What the backend publishes since 2026-09-16: an envelope any consumer can route, deduplicate, trace and version-check without understanding the payload, around a payload whose shape depends on eventType. Version 2 because moving the fields into `payload` is a breaking change from version 1 (contracts/ai-events/v1), which consumers still accept; see docs/EVENT_SCHEMA.md. Produced by com.skillbridge.shared.messaging.EventEnvelope; read by skillbridge-ai-service/ai_event_contract.py::parse_event. The schema is strict (no unlisted fields) so that adding a field is a reviewed change to this file; consumers are tolerant readers, which is what lets such an addition ship without a version bump.",
  "type": "object",
  "required": [
    "eventId", "eventType", "schemaVersion", "occurredAt",
    "aggregateType", "aggregateId", "collegeId", "traceId", "payload"
  ],
  "additionalProperties": false,
  "properties": {
    "eventId": {
      "description": "Unique per event, and equal to the AMQP message_id. What consumers deduplicate on. A replay gets a new one.",
      "$ref": "#/$defs/uuid"
    },
    "eventType": {
      "description": "Which handler runs, and which payload shape follows.",
      "enum": ["SKILL_UPDATED", "PROFILE_UPDATED"]
    },
    "schemaVersion": {
      "description": "The version of this event type's payload. This file describes version 2 only; a consumer that meets a version it does not support must refuse the message loudly, not guess.",
      "const": 2
    },
    "occurredAt": {
      "description": "When the business change happened, UTC, ISO-8601 with a Z. Not when it was published: the relay may send it minutes later.",
      "type": "string",
      "pattern": "^[0-9]{4}-[0-9]{2}-[0-9]{2}T[0-9]{2}:[0-9]{2}:[0-9]{2}(\\.[0-9]{1,9})?Z$"
    },
    "aggregateType": {
      "description": "The kind of thing that changed.",
      "type": "string", "minLength": 1, "maxLength": 100
    },
    "aggregateId": {
      "description": "Which one. A string, whatever the key's type in the database.",
      "type": "string", "minLength": 1, "maxLength": 100
    },
    "collegeId": {
      "description": "The tenant, so a consumer can scope what it does. Null only for an event that belongs to no college.",
      "type": ["integer", "null"], "minimum": 1
    },
    "traceId": {
      "description": "The correlation id of the request that caused the event, or null if there was none (a scheduled job).",
      "type": ["string", "null"], "maxLength": 64
    },
    "replayOf": {
      "description": "Present only on a replay from the dead-letter queue: the eventId of the event it re-sends.",
      "$ref": "#/$defs/uuid"
    },
    "payload": {
      "description": "The event itself. Its shape is chosen by eventType; see the rules below.",
      "type": "object"
    }
  },
  "allOf": [
    {
      "if": { "properties": { "eventType": { "const": "SKILL_UPDATED" } } },
      "then": { "properties": { "payload": { "$ref": "#/$defs/SkillUpdated" } } }
    },
    {
      "if": { "properties": { "eventType": { "const": "PROFILE_UPDATED" } } },
      "then": { "properties": { "payload": { "$ref": "#/$defs/ProfileUpdated" } } }
    }
  ],
  "$defs": {
    "uuid": {
      "type": "string",
      "pattern": "^[0-9a-f]{8}-[0-9a-f]{4}-[0-9a-f]{4}-[0-9a-f]{4}-[0-9a-f]{12}$"
    },
    "SkillUpdated": {
      "description": "A student added a skill or changed its proficiency. Version 1 carried skillId in metadata.",
      "type": "object",
      "required": ["studentId", "skillId"],
      "additionalProperties": false,
      "properties": {
        "studentId": { "type": "integer", "minimum": 1 },
        "skillId": { "type": "integer", "minimum": 1 }
      }
    },
    "ProfileUpdated": {
      "description": "A student changed profile fields the analysis reads.",
      "type": "object",
      "required": ["studentId"],
      "additionalProperties": false,
      "properties": {
        "studentId": { "type": "integer", "minimum": 1 }
      }
    }
  }
}
